<?xml version="1.0" encoding="UTF-8"?><!DOCTYPE Entry SYSTEM "VerbenModel.dtd"><?xml-stylesheet type="text/xsl" href="VerbRenderTemplate.xslt"?><Entry category="Verben">
	<Stichwort>surfen</Stichwort>
	<Einheit>6</Einheit>
	<Anteil>Übungen</Anteil>
	<Konjugation>
				<Präsen>
					<ich>surfe</ich>
					<du>surfst</du>
					<er_sie_es>surft</er_sie_es>
					<wir>surfen</wir>
					<ihr>surft</ihr>
					<sie_Sie>surfen</sie_Sie>
				</Präsen>
				<Präteritum>
					<ich>surfte</ich>
					<du>surftest</du>
					<er_sie_es>surfte</er_sie_es>
					<wir>surften</wir>
					<ihr>surftet</ihr>
					<sie_Sie>surften</sie_Sie>
				</Präteritum>
				<Perfekt hilfsverb="haben">	
					<ich>habe gesurft</ich>
					<du>hast gesurft</du>
					<er_sie_es>hat gesurft</er_sie_es>
					<wir>haben gesurft</wir>
					<ihr>habt gesurft</ihr>
					<sie_Sie>haben gesurft</sie_Sie>
				</Perfekt>
	</Konjugation>
			
			
	<zusammengesetzteWörter>
			<KompositaCollection>
			</KompositaCollection>
			<abgeleiteteWörter>
			</abgeleiteteWörter>
	</zusammengesetzteWörter>
		<Synonymegruppe>
			<Sym/>
		</Synonymegruppe>
		<Antonymegruppe>
			<Anm/>
		</Antonymegruppe>

		<Kollokationen>
		<K/>
		</Kollokationen>
		<AllgemeineErläuterungen>
				<Eintrag transitiv="">
					
					<Chinesisch>冲浪运动，网络漫游</Chinesisch>
					<BeispielSammlung>
					<Beispiel>
					<Satz>Er surft gern im Internet.</Satz>
					<Übersetzung/>
					</Beispiel>
					</BeispielSammlung>
					
   				</Eintrag>
			</AllgemeineErläuterungen>
	
	
</Entry>
