<?xml version="1.0" encoding="UTF-8"?><!DOCTYPE Entry SYSTEM "VerbenModel.dtd"><?xml-stylesheet type="text/xsl" href="VerbRenderTemplate.xslt"?><Entry category="Verben">
	<Stichwort>auspacken</Stichwort>
	<Einheit>7</Einheit>
	<Anteil>Leseverstehen</Anteil>
	<Konjugation>
				<Präsen>
					<ich>packe aus</ich>
					<du>packst aus</du>
					<er_sie_es>packt aus</er_sie_es>
					<wir>packen aus</wir>
					<ihr>packt aus</ihr>
					<sie_Sie>packen aus</sie_Sie>
				</Präsen>
				<Präteritum>
					<ich>packte aus</ich>
					<du>packtest aus</du>
					<er_sie_es>packte aus</er_sie_es>
					<wir>packten aus</wir>
					<ihr>packtet aus</ihr>
					<sie_Sie>packten aus</sie_Sie>
				</Präteritum>
				<Perfekt hilfsverb="haben">	
					<ich>habe ausgepackt</ich>
					<du>hast ausgepackt</du>
					<er_sie_es>hat ausgepackt</er_sie_es>
					<wir>haben ausgepackt</wir>
					<ihr>habt ausgepackt</ihr>
					<sie_Sie>haben ausgepackt</sie_Sie>
				</Perfekt>
	</Konjugation>
			
			
	<zusammengesetzteWörter>
			<KompositaCollection>
			</KompositaCollection>
			<abgeleiteteWörter>
			</abgeleiteteWörter>
	</zusammengesetzteWörter>
		<Synonymegruppe>
			<Sym/>
		</Synonymegruppe>
		<Antonymegruppe>
			<Anm/>
		</Antonymegruppe>

		<Kollokationen>
		<K/>
		</Kollokationen>
		<AllgemeineErläuterungen>
				<Eintrag transitiv="">
					
					<Chinesisch>打开（包装），取出</Chinesisch>
					<BeispielSammlung>
					<Beispiel>
					<Satz>Er packt das Geschenk sofort aus.</Satz>
					<Übersetzung/>
					</Beispiel>
					</BeispielSammlung>
					
   				</Eintrag>
			</AllgemeineErläuterungen>
	
	
</Entry>
