<?xml version="1.0" encoding="UTF-8"?><!DOCTYPE Entry SYSTEM "VerbenModel.dtd"><?xml-stylesheet type="text/xsl" href="VerbRenderTemplate.xslt"?><Entry category="Verben">
	<Stichwort>danken</Stichwort>
	<Einheit>5</Einheit>
	<Anteil>Text</Anteil>
	<Konjugation>
				<Präsen>
					<ich>danke</ich>
					<du>dankst</du>
					<er_sie_es>dankt</er_sie_es>
					<wir>danken</wir>
					<ihr>dankt</ihr>
					<sie_Sie>danken</sie_Sie>
				</Präsen>
				<Präteritum>
					<ich>dankte</ich>
					<du>danktest</du>
					<er_sie_es>dankte</er_sie_es>
					<wir>dankten</wir>
					<ihr>danktet</ihr>
					<sie_Sie>dankten</sie_Sie>
				</Präteritum>
				<Perfekt hilfsverb="haben">	
					<ich>habe gedankt</ich>
					<du>hast gedankt</du>
					<er_sie_es>hat gedankt</er_sie_es>
					<wir>haben gedankt</wir>
					<ihr>habt gedankt</ihr>
					<sie_Sie>haben gedankt</sie_Sie>
				</Perfekt>
	</Konjugation>
			
			
	<zusammengesetzteWörter>
			<KompositaCollection>
			</KompositaCollection>
			<abgeleiteteWörter>
			</abgeleiteteWörter>
	</zusammengesetzteWörter>
		<Synonymegruppe>
			<Sym/>
		</Synonymegruppe>
		<Antonymegruppe>
			<Anm/>
		</Antonymegruppe>

		<Kollokationen>
		<K/>
		</Kollokationen>
		<AllgemeineErläuterungen>
				<Eintrag transitiv="">
					
					<Chinesisch>感谢</Chinesisch>
					<BeispielSammlung>
					<Beispiel>
					<Satz>Ich danke dir für das Essen.</Satz>
					<Übersetzung/>
					</Beispiel>
					</BeispielSammlung>
					
   				</Eintrag>
			</AllgemeineErläuterungen>
	
	
</Entry>
