<?xml version="1.0" encoding="UTF-8"?><!DOCTYPE Entry SYSTEM "VerbenModel.dtd"><?xml-stylesheet type="text/xsl" href="VerbRenderTemplate.xslt"?><Entry category="Verben">
	<Stichwort>bleiben</Stichwort>
	<Einheit>8</Einheit>
	<Anteil>Übungen</Anteil>
	<Konjugation>
				<Präsen>
					<ich>bleibe</ich>
					<du>bleibst</du>
					<er_sie_es>bleibt</er_sie_es>
					<wir>bleiben</wir>
					<ihr>bleibt</ihr>
					<sie_Sie>bleiben</sie_Sie>
				</Präsen>
				<Präteritum>
					<ich>blieb</ich>
					<du>bliebst</du>
					<er_sie_es>blieb</er_sie_es>
					<wir>blieben</wir>
					<ihr>bliebt</ihr>
					<sie_Sie>blieben</sie_Sie>
				</Präteritum>
				<Perfekt hilfsverb="sein">	
					<ich>bin geblieben</ich>
					<du>bist geblieben</du>
					<er_sie_es>ist geblieben</er_sie_es>
					<wir>sind geblieben</wir>
					<ihr>seid geblieben</ihr>
					<sie_Sie>sind geblieben</sie_Sie>
				</Perfekt>
	</Konjugation>
			
			
	<zusammengesetzteWörter>
			<KompositaCollection>
			</KompositaCollection>
			<abgeleiteteWörter>
			</abgeleiteteWörter>
	</zusammengesetzteWörter>
		<Synonymegruppe>
			<Sym/>
		</Synonymegruppe>
		<Antonymegruppe>
			<Anm/>
		</Antonymegruppe>

		<Kollokationen>
		<K/>
		</Kollokationen>
		<AllgemeineErläuterungen>
				<Eintrag transitiv="">
					
					<Chinesisch>待，停留</Chinesisch>
					<BeispielSammlung>
					<Beispiel>
					<Satz>Ich bin zu Hause geblieben.</Satz>
					<Übersetzung/>
					</Beispiel>
					</BeispielSammlung>
					
   				</Eintrag>
			</AllgemeineErläuterungen>
	
	
</Entry>
