<?xml version="1.0" encoding="UTF-8"?><!DOCTYPE Entry SYSTEM "VerbenModel.dtd"><?xml-stylesheet type="text/xsl" href="VerbRenderTemplate.xslt"?><Entry category="Verben">
	<Stichwort>tun</Stichwort>
	<Einheit>9</Einheit>
	<Anteil>Leseverstehen</Anteil>
	<Konjugation>
				<Präsen>
					<ich>tue</ich>
					<du>tust</du>
					<er_sie_es>tut</er_sie_es>
					<wir>tun</wir>
					<ihr>tut</ihr>
					<sie_Sie>tun</sie_Sie>
				</Präsen>
				<Präteritum>
					<ich>tat</ich>
					<du>tatest</du>
					<er_sie_es>tat</er_sie_es>
					<wir>taten</wir>
					<ihr>tatet</ihr>
					<sie_Sie>taten</sie_Sie>
				</Präteritum>
				<Perfekt hilfsverb="haben">	
					<ich>habe getan</ich>
					<du>hast getan</du>
					<er_sie_es>hat getan</er_sie_es>
					<wir>haben getan</wir>
					<ihr>habt getan</ihr>
					<sie_Sie>haben getan</sie_Sie>
				</Perfekt>
	</Konjugation>
			
			
	<zusammengesetzteWörter>
			<KompositaCollection>
			</KompositaCollection>
			<abgeleiteteWörter>
			</abgeleiteteWörter>
	</zusammengesetzteWörter>
		<Synonymegruppe>
			<Sym/>
		</Synonymegruppe>
		<Antonymegruppe>
			<Anm/>
		</Antonymegruppe>

		<Kollokationen>
		<K/>
		</Kollokationen>
		<AllgemeineErläuterungen>
				<Eintrag transitiv="">
					
					<Chinesisch>做，干</Chinesisch>
					<BeispielSammlung>
					<Beispiel>
					<Satz>Was soll ich tun?</Satz>
					<Übersetzung/>
					</Beispiel>
					</BeispielSammlung>
					
   				</Eintrag>
			</AllgemeineErläuterungen>
	
	
</Entry>
