<?xml version="1.0" encoding="UTF-8"?><!DOCTYPE Entry SYSTEM "VerbenModel.dtd"><?xml-stylesheet type="text/xsl" href="VerbRenderTemplate.xslt"?><Entry category="Verben">
	<Stichwort>zeigen</Stichwort>
	<Einheit>6</Einheit>
	<Anteil>Text</Anteil>
	<Konjugation>
				<Präsen>
					<ich>zeige</ich>
					<du>zeigst</du>
					<er_sie_es>zeigt</er_sie_es>
					<wir>zeigen</wir>
					<ihr>zeigt</ihr>
					<sie_Sie>zeigen</sie_Sie>
				</Präsen>
				<Präteritum>
					<ich>zeigte</ich>
					<du>zeigtest</du>
					<er_sie_es>zeigte</er_sie_es>
					<wir>zeigten</wir>
					<ihr>zeigtet</ihr>
					<sie_Sie>zeigten</sie_Sie>
				</Präteritum>
				<Perfekt hilfsverb="haben">	
					<ich>habe gezeigt</ich>
					<du>hast gezeigt</du>
					<er_sie_es>hat gezeigt</er_sie_es>
					<wir>haben gezeigt</wir>
					<ihr>habt gezeigt</ihr>
					<sie_Sie>haben gezeigt</sie_Sie>
				</Perfekt>
	</Konjugation>
			
			
	<zusammengesetzteWörter>
			<KompositaCollection>
			</KompositaCollection>
			<abgeleiteteWörter>
			</abgeleiteteWörter>
	</zusammengesetzteWörter>
		<Synonymegruppe>
			<Sym/>
		</Synonymegruppe>
		<Antonymegruppe>
			<Anm/>
		</Antonymegruppe>

		<Kollokationen>
		<K/>
		</Kollokationen>
		<AllgemeineErläuterungen>
				<Eintrag transitiv="">
					
					<Chinesisch>给……看</Chinesisch>
					<BeispielSammlung>
					<Beispiel>
					<Satz>Sie zeigt ihm die Wohnung.</Satz>
					<Übersetzung/>
					</Beispiel>
					</BeispielSammlung>
					
   				</Eintrag>
			</AllgemeineErläuterungen>
	
	
</Entry>
