<?xml version="1.0" encoding="UTF-8"?><!DOCTYPE Entry SYSTEM "VerbenModel.dtd"><?xml-stylesheet type="text/xsl" href="VerbRenderTemplate.xslt"?><Entry category="Verben">
	<Stichwort>hierherkommen</Stichwort>
	<Einheit>5</Einheit>
	<Anteil>Text</Anteil>
	<Konjugation>
				<Präsen>
					<ich>komme hierher</ich>
					<du>kommst hierher</du>
					<er_sie_es>kommt hierher</er_sie_es>
					<wir>kommen hierher</wir>
					<ihr>kommt hierher</ihr>
					<sie_Sie>kommen hierher</sie_Sie>
				</Präsen>
				<Präteritum>
					<ich>kam hierher</ich>
					<du>kamst hierher</du>
					<er_sie_es>kam hierher</er_sie_es>
					<wir>kamen hierher</wir>
					<ihr>kamt hierher</ihr>
					<sie_Sie>kamen hierher</sie_Sie>
				</Präteritum>
				<Perfekt hilfsverb="sein">	
					<ich>bin hierhergekommen</ich>
					<du>bist hierhergekommen</du>
					<er_sie_es>ist hierhergekommen</er_sie_es>
					<wir>sind hierhergekommen</wir>
					<ihr>seid hierhergekommen</ihr>
					<sie_Sie>sind hierhergekommen</sie_Sie>
				</Perfekt>
	</Konjugation>
			
			
	<zusammengesetzteWörter>
			<KompositaCollection>
			</KompositaCollection>
			<abgeleiteteWörter>
			</abgeleiteteWörter>
	</zusammengesetzteWörter>
		<Synonymegruppe>
			<Sym/>
		</Synonymegruppe>
		<Antonymegruppe>
			<Anm/>
		</Antonymegruppe>

		<Kollokationen>
		<K/>
		</Kollokationen>
		<AllgemeineErläuterungen>
				<Eintrag transitiv="">
					
					<Chinesisch>到这儿来</Chinesisch>
					<BeispielSammlung>
					<Beispiel>
					<Satz>Ich komme oft hierher.</Satz>
					<Übersetzung/>
					</Beispiel>
					</BeispielSammlung>
					
   				</Eintrag>
			</AllgemeineErläuterungen>
	
	
</Entry>
