<?xml version="1.0" encoding="UTF-8"?><!DOCTYPE Entry SYSTEM "VerbenModel.dtd"><?xml-stylesheet type="text/xsl" href="VerbRenderTemplate.xslt"?><Entry category="Verben">
	<Stichwort>verbringen</Stichwort>
	<Einheit>8</Einheit>
	<Anteil>Text</Anteil>
	<Konjugation>
				<Präsen>
					<ich>verbringe</ich>
					<du>verbringst</du>
					<er_sie_es>verbringt</er_sie_es>
					<wir>verbringen</wir>
					<ihr>verbringt</ihr>
					<sie_Sie>verbringen</sie_Sie>
				</Präsen>
				<Präteritum>
					<ich>verbrachte</ich>
					<du>verbrachtest</du>
					<er_sie_es>verbrachte</er_sie_es>
					<wir>verbrachten</wir>
					<ihr>verbrachtet</ihr>
					<sie_Sie>verbrachten</sie_Sie>
				</Präteritum>
				<Perfekt hilfsverb="haben">	
					<ich>habe verbracht</ich>
					<du>hast verbracht</du>
					<er_sie_es>hat verbracht</er_sie_es>
					<wir>haben verbracht</wir>
					<ihr>habt verbracht</ihr>
					<sie_Sie>haben verbracht</sie_Sie>
				</Perfekt>
	</Konjugation>
			
			
	<zusammengesetzteWörter>
			<KompositaCollection>
			</KompositaCollection>
			<abgeleiteteWörter>
			</abgeleiteteWörter>
	</zusammengesetzteWörter>
		<Synonymegruppe>
			<Sym/>
		</Synonymegruppe>
		<Antonymegruppe>
			<Anm/>
		</Antonymegruppe>

		<Kollokationen>
		<K/>
		</Kollokationen>
		<AllgemeineErläuterungen>
				<Eintrag transitiv="">
					
					<Chinesisch>度过（时间，假期）</Chinesisch>
					<BeispielSammlung>
					<Beispiel>
					<Satz>Er hat einen Monat auf dem Land verbracht und viel erlebt.</Satz>
					<Übersetzung/>
					</Beispiel>
					</BeispielSammlung>
					
   				</Eintrag>
			</AllgemeineErläuterungen>
	
	
</Entry>
