<?xml version="1.0" encoding="UTF-8"?><!DOCTYPE Entry SYSTEM "VerbenModel.dtd"><?xml-stylesheet type="text/xsl" href="VerbRenderTemplate.xslt"?><Entry category="Verben">
	<Stichwort>können</Stichwort>
	<Einheit>7</Einheit>
	<Anteil>Text</Anteil>
	<Konjugation>
				<Präsen>
					<ich>kann</ich>
					<du>kannst</du>
					<er_sie_es>kann</er_sie_es>
					<wir>können</wir>
					<ihr>könnt</ihr>
					<sie_Sie>können</sie_Sie>
				</Präsen>
				<Präteritum>
					<ich>konnte</ich>
					<du>konntest</du>
					<er_sie_es>konnte</er_sie_es>
					<wir>konnten</wir>
					<ihr>konntet</ihr>
					<sie_Sie>konnten</sie_Sie>
				</Präteritum>
				<Perfekt hilfsverb="haben">	
					<ich>habe gekonnt</ich>
					<du>hast gekonnt</du>
					<er_sie_es>hat gekonnt</er_sie_es>
					<wir>haben gekonnt</wir>
					<ihr>habt gekonnt</ihr>
					<sie_Sie>haben gekonnt</sie_Sie>
				</Perfekt>
	</Konjugation>
			
			
	<zusammengesetzteWörter>
			<KompositaCollection>
			</KompositaCollection>
			<abgeleiteteWörter>
			</abgeleiteteWörter>
	</zusammengesetzteWörter>
		<Synonymegruppe>
			<Sym/>
		</Synonymegruppe>
		<Antonymegruppe>
			<Anm/>
		</Antonymegruppe>

		<Kollokationen>
		<K/>
		</Kollokationen>
		<AllgemeineErläuterungen>
				<Eintrag transitiv="">
					
					<Chinesisch>能够，会，可能</Chinesisch>
					<BeispielSammlung>
					<Beispiel>
					<Satz>Was kann ich ihr blop schenken?</Satz>
					<Übersetzung/>
					</Beispiel>
					</BeispielSammlung>
					
   				</Eintrag>
			</AllgemeineErläuterungen>
	
	
</Entry>
