<?xml version="1.0" encoding="UTF-8"?><!DOCTYPE Entry SYSTEM "VerbenModel.dtd"><?xml-stylesheet type="text/xsl" href="VerbRenderTemplate.xslt"?><Entry category="Verben">
	<Stichwort>fahren</Stichwort>
	<Einheit>3</Einheit>
	<Anteil>Einfürung</Anteil>
	<Konjugation>
				<Präsen>
					<ich/>
					<du/>
					<er_sie_es/>
					<wir/>
					<ihr/>
					<sie_Sie/>
				</Präsen>
				<Präteritum>
					<ich/>
					<du/>
					<er_sie_es/>
					<wir/>
					<ihr/>
					<sie_Sie/>
				</Präteritum>
				<Perfekt hilfsverb="">	
					<ich/>
					<du/>
					<er_sie_es/>
					<wir/>
					<ihr/>
					<sie_Sie/>
				</Perfekt>
	</Konjugation>
			
			
	<zusammengesetzteWörter>
			<KompositaCollection>
			</KompositaCollection>
			<abgeleiteteWörter>
			</abgeleiteteWörter>
	</zusammengesetzteWörter>
		<Synonymegruppe>
			<Sym/>
		</Synonymegruppe>
		<Antonymegruppe>
			<Anm/>
		</Antonymegruppe>

		<Kollokationen>
		<K/>
		</Kollokationen>
		<AllgemeineErläuterungen>
				<Eintrag transitiv="">
					
					<Chinesisch>搭，乘，坐（车）；行驶</Chinesisch>
					<BeispielSammlung>
					<Beispiel>
					<Satz>Ich fahre gern Rad.</Satz>
					<Übersetzung/>
					</Beispiel>
					</BeispielSammlung>
					
   				</Eintrag>
			</AllgemeineErläuterungen>
	
	
</Entry>