<?xml version="1.0" encoding="UTF-8"?><!DOCTYPE Entry SYSTEM "VerbenModel.dtd"><?xml-stylesheet type="text/xsl" href="VerbRenderTemplate.xslt"?><Entry category="Verben">
	<Stichwort>fliegen</Stichwort>
	<Einheit>9</Einheit>
	<Anteil>Text</Anteil>
	<Konjugation>
				<Präsen>
					<ich>fliege</ich>
					<du>fliegst</du>
					<er_sie_es>fliegt</er_sie_es>
					<wir>fliegen</wir>
					<ihr>fliegt</ihr>
					<sie_Sie>fliegen</sie_Sie>
				</Präsen>
				<Präteritum>
					<ich>flog</ich>
					<du>flogst</du>
					<er_sie_es>flog</er_sie_es>
					<wir>flogen</wir>
					<ihr>flogt</ihr>
					<sie_Sie>flogen</sie_Sie>
				</Präteritum>
				<Perfekt hilfsverb="sein">	
					<ich>bin geflogen</ich>
					<du>bist geflogen</du>
					<er_sie_es>ist geflogen</er_sie_es>
					<wir>sind geflogen</wir>
					<ihr>seid geflogen</ihr>
					<sie_Sie>sind geflogen</sie_Sie>
				</Perfekt>
	</Konjugation>
			
			
	<zusammengesetzteWörter>
			<KompositaCollection>
			</KompositaCollection>
			<abgeleiteteWörter>
			</abgeleiteteWörter>
	</zusammengesetzteWörter>
		<Synonymegruppe>
			<Sym/>
		</Synonymegruppe>
		<Antonymegruppe>
			<Anm/>
		</Antonymegruppe>

		<Kollokationen>
		<K/>
		</Kollokationen>
		<AllgemeineErläuterungen>
				<Eintrag transitiv="">
					
					<Chinesisch>飞，飞翔</Chinesisch>
					<BeispielSammlung>
					<Beispiel>
					<Satz>Er ist ins Ausland geflogen.</Satz>
					<Übersetzung/>
					</Beispiel>
					</BeispielSammlung>
					
   				</Eintrag>
			</AllgemeineErläuterungen>
	
	
</Entry>
