<?xml version="1.0" encoding="UTF-8"?><!DOCTYPE Entry SYSTEM "VerbenModel.dtd"><?xml-stylesheet type="text/xsl" href="VerbRenderTemplate.xslt"?><Entry category="Verben">
	<Stichwort>besichtigen</Stichwort>
	<Einheit>6</Einheit>
	<Anteil>Text</Anteil>
	<Konjugation>
				<Präsen>
					<ich>besichtige</ich>
					<du>besichtigst</du>
					<er_sie_es>besichtigt</er_sie_es>
					<wir>besichtigen</wir>
					<ihr>besichtigt</ihr>
					<sie_Sie>besichtigen</sie_Sie>
				</Präsen>
				<Präteritum>
					<ich>besichtigte</ich>
					<du>besichtigtest</du>
					<er_sie_es>besichtigte</er_sie_es>
					<wir>besichtigten</wir>
					<ihr>besichtigtet</ihr>
					<sie_Sie>besichtigten</sie_Sie>
				</Präteritum>
				<Perfekt hilfsverb="haben">	
					<ich>habe besichtigt</ich>
					<du>hast besichtigt</du>
					<er_sie_es>hat besichtigt</er_sie_es>
					<wir>haben besichtigt</wir>
					<ihr>habt besichtigt</ihr>
					<sie_Sie>haben besichtigt</sie_Sie>
				</Perfekt>
	</Konjugation>
			
			
	<zusammengesetzteWörter>
			<KompositaCollection>
			</KompositaCollection>
			<abgeleiteteWörter>
			</abgeleiteteWörter>
	</zusammengesetzteWörter>
		<Synonymegruppe>
			<Sym/>
		</Synonymegruppe>
		<Antonymegruppe>
			<Anm/>
		</Antonymegruppe>

		<Kollokationen>
		<K/>
		</Kollokationen>
		<AllgemeineErläuterungen>
				<Eintrag transitiv="">
					
					<Chinesisch>参观</Chinesisch>
					<BeispielSammlung>
					<Beispiel>
					<Satz>Er besichtigt eine Mietwohung.</Satz>
					<Übersetzung/>
					</Beispiel>
					</BeispielSammlung>
					
   				</Eintrag>
			</AllgemeineErläuterungen>
	
	
</Entry>
