<?xml version="1.0" encoding="UTF-8"?><!DOCTYPE Entry SYSTEM "VerbenModel.dtd"><?xml-stylesheet type="text/xsl" href="VerbRenderTemplate.xslt"?><Entry category="Verben">
	<Stichwort>anrufen</Stichwort>
	<Einheit>4</Einheit>
	<Anteil>Übungen</Anteil>
	<Konjugation>
				<Präsen>
					<ich>rufe an</ich>
					<du>rufst an</du>
					<er_sie_es>ruft an</er_sie_es>
					<wir>rufen an</wir>
					<ihr>ruft an</ihr>
					<sie_Sie>rufen an</sie_Sie>
				</Präsen>
				<Präteritum>
					<ich>rief an</ich>
					<du>riefst an</du>
					<er_sie_es>rief an</er_sie_es>
					<wir>riefen an</wir>
					<ihr>rieft an</ihr>
					<sie_Sie>riefen an</sie_Sie>
				</Präteritum>
				<Perfekt hilfsverb="haben">	
					<ich>habe angerufen</ich>
					<du>hast angerufen</du>
					<er_sie_es>hat angerufen</er_sie_es>
					<wir>haben angerufen</wir>
					<ihr>habt angerufen</ihr>
					<sie_Sie>haben angerufen</sie_Sie>
				</Perfekt>
	</Konjugation>
			
			
	<zusammengesetzteWörter>
			<KompositaCollection>
			</KompositaCollection>
			<abgeleiteteWörter>
			</abgeleiteteWörter>
	</zusammengesetzteWörter>
		<Synonymegruppe>
			<Sym/>
		</Synonymegruppe>
		<Antonymegruppe>
			<Anm/>
		</Antonymegruppe>

		<Kollokationen>
		<K/>
		</Kollokationen>
		<AllgemeineErläuterungen>
				<Eintrag transitiv="">
					
					<Chinesisch>打电话</Chinesisch>
					<BeispielSammlung>
					<Beispiel>
					<Satz>Rufen Sie mich bitte an!</Satz>
					<Übersetzung/>
					</Beispiel>
					</BeispielSammlung>
					
   				</Eintrag>
			</AllgemeineErläuterungen>
	
	
</Entry>
