<?xml version="1.0" encoding="UTF-8"?><!DOCTYPE Entry SYSTEM "VerbenModel.dtd"><?xml-stylesheet type="text/xsl" href="VerbRenderTemplate.xslt"?><Entry category="Verben">
	<Stichwort>leidtun</Stichwort>
	<Einheit>4</Einheit>
	<Anteil>Intentionen</Anteil>
	<Konjugation>
				<Präsen>
          <ich>tu leid</ich>
					<du>tust leid</du>
          <er_sie_es>tut leid</er_sie_es>
          <wir>tun leid</wir>
          <ihr>tut leid</ihr>
          <sie_Sie>tun leid</sie_Sie>
				</Präsen>
				<Präteritum>
          <ich>tat leid</ich>
          <du>tatest leid</du>
					<er_sie_es>tat leid</er_sie_es>
          <wir>taten leid</wir>
          <ihr>tatet leid</ihr>
          <sie_Sie>taten leid</sie_Sie>
				</Präteritum>
				<Perfekt hilfsverb="haben">
          <ich>habe leidgetan</ich>
          <du>hast leidgetan</du>
          <er_sie_es>hat leidgetan</er_sie_es>
          <wir>haben leidgetan</wir>
          <ihr>habt leidgetan</ihr>
          <sie_Sie>haben leidgetan</sie_Sie>
				</Perfekt>
	</Konjugation>
			
			
	<zusammengesetzteWörter>
			<KompositaCollection>
			</KompositaCollection>
			<abgeleiteteWörter>
			</abgeleiteteWörter>
	</zusammengesetzteWörter>
		<Synonymegruppe>
			<Sym/>
		</Synonymegruppe>
		<Antonymegruppe>
			<Anm/>
		</Antonymegruppe>

		<Kollokationen>
		<K/>
		</Kollokationen>
		<AllgemeineErläuterungen>
				<Eintrag transitiv="">
					
					<Chinesisch>遗憾，抱歉</Chinesisch>
					<BeispielSammlung>
					<Beispiel>
					<Satz>Es tut mir leid.</Satz>
					<Übersetzung/>
					</Beispiel>
					</BeispielSammlung>
					
   				</Eintrag>
			</AllgemeineErläuterungen>
	
	
</Entry>
