<?xml version="1.0" encoding="UTF-8"?><!DOCTYPE Entry SYSTEM "VerbenModel.dtd"><?xml-stylesheet type="text/xsl" href="VerbRenderTemplate.xslt"?><Entry category="Verben">
	<Stichwort>wohnen</Stichwort>
	<Einheit>2</Einheit>
	<Anteil>Text</Anteil>
	<Konjugation>
				<Präsen>
					<ich>wohne</ich>
					<du>wohnst</du>
					<er_sie_es>wohnt</er_sie_es>
					<wir>wohnen</wir>
					<ihr>wohnt</ihr>
					<sie_Sie>wohnen</sie_Sie>
				</Präsen>
				<Präteritum>
					<ich>wohnte</ich>
					<du>wohntest</du>
					<er_sie_es>wohnte</er_sie_es>
					<wir>wohnten</wir>
					<ihr>wohntet</ihr>
					<sie_Sie>wohnten</sie_Sie>
				</Präteritum>
				<Perfekt hilfsverb="haben">	
					<ich>habe gewohnt</ich>
					<du>hast gewohnt</du>
					<er_sie_es>hat gewohnt</er_sie_es>
					<wir>haben gewohnt</wir>
					<ihr>habt gewohnt</ihr>
					<sie_Sie>haben gewohnt</sie_Sie>
				</Perfekt>
	</Konjugation>
			
			
	<zusammengesetzteWörter>
			<KompositaCollection>
			</KompositaCollection>
			<abgeleiteteWörter>
			</abgeleiteteWörter>
	</zusammengesetzteWörter>
		<Synonymegruppe>
			<Sym/>
		</Synonymegruppe>
		<Antonymegruppe>
			<Anm/>
		</Antonymegruppe>

		<Kollokationen>
		<K/>
		</Kollokationen>
		<AllgemeineErläuterungen>
				<Eintrag transitiv="">
					
					<Chinesisch>居住</Chinesisch>
					<BeispielSammlung>
					<Beispiel>
					<Satz>Wir wohnen im Studentenwohnheim.</Satz>
					<Übersetzung/>
					</Beispiel>
					</BeispielSammlung>
					
   				</Eintrag>
			</AllgemeineErläuterungen>
	
	
</Entry>
