<?xml version="1.0" encoding="UTF-8"?><!DOCTYPE Entry SYSTEM "VerbenModel.dtd"><?xml-stylesheet type="text/xsl" href="VerbRenderTemplate.xslt"?><Entry category="Verben">
	<Stichwort>dauern</Stichwort>
	<Einheit>8</Einheit>
	<Anteil>Text</Anteil>
	<Konjugation>
				<Präsen>
					<ich>dauere</ich>
					<du>daure</du>
					<er_sie_es>dauerst</er_sie_es>
					<wir>dauert</wir>
					<ihr>dauern</ihr>
					<sie_Sie>dauert</sie_Sie>
				</Präsen>
				<Präteritum>
					<ich>Sie</ich>
					<du>dauerte</du>
					<er_sie_es>dauertest</er_sie_es>
					<wir>dauerte</wir>
					<ihr>dauerten</ihr>
					<sie_Sie>dauertet</sie_Sie>
				</Präteritum>
				<Perfekt hilfsverb="haben">	
					<ich>habe gedauert</ich>
					<du>hast gedauert</du>
					<er_sie_es>hat gedauert</er_sie_es>
					<wir>haben gedauert</wir>
					<ihr>habt gedauert</ihr>
					<sie_Sie>haben gedauert</sie_Sie>
				</Perfekt>
	</Konjugation>
			
			
	<zusammengesetzteWörter>
			<KompositaCollection>
			</KompositaCollection>
			<abgeleiteteWörter>
			</abgeleiteteWörter>
	</zusammengesetzteWörter>
		<Synonymegruppe>
			<Sym/>
		</Synonymegruppe>
		<Antonymegruppe>
			<Anm/>
		</Antonymegruppe>

		<Kollokationen>
		<K/>
		</Kollokationen>
		<AllgemeineErläuterungen>
				<Eintrag transitiv="">
					
					<Chinesisch>续，延续</Chinesisch>
					<BeispielSammlung>
					<Beispiel>
					<Satz>Die Fahrt dauert drei Stunden.</Satz>
					<Übersetzung/>
					</Beispiel>
					</BeispielSammlung>
					
   				</Eintrag>
			</AllgemeineErläuterungen>
	
	
</Entry>
