<?xml version="1.0" encoding="UTF-8"?><!DOCTYPE Entry SYSTEM "VerbenModel.dtd"><?xml-stylesheet type="text/xsl" href="VerbRenderTemplate.xslt"?><Entry category="Verben">
	<Stichwort>gefallen</Stichwort>
	<Einheit>5</Einheit>
	<Anteil>Text</Anteil>
	<Konjugation>
				<Präsen>
					<ich>gefalle</ich>
					<du>gefällst</du>
					<er_sie_es>gefällt</er_sie_es>
					<wir>gefallen</wir>
					<ihr>gefallt</ihr>
					<sie_Sie>gefallen</sie_Sie>
				</Präsen>
				<Präteritum>
					<ich>gefiel</ich>
					<du>gefielst</du>
					<er_sie_es>gefiel</er_sie_es>
					<wir>gefielen</wir>
					<ihr>gefielt</ihr>
					<sie_Sie>gefielen</sie_Sie>
				</Präteritum>
				<Perfekt hilfsverb="sein">	
					<ich>bin gefallen</ich>
					<du>bist gefallen</du>
					<er_sie_es>ist gefallen</er_sie_es>
					<wir>sind gefallen</wir>
					<ihr>seid gefallen</ihr>
					<sie_Sie>sind gefallen</sie_Sie>
				</Perfekt>
	</Konjugation>
			
			
	<zusammengesetzteWörter>
			<KompositaCollection>
			</KompositaCollection>
			<abgeleiteteWörter>
			</abgeleiteteWörter>
	</zusammengesetzteWörter>
		<Synonymegruppe>
			<Sym/>
		</Synonymegruppe>
		<Antonymegruppe>
			<Anm/>
		</Antonymegruppe>

		<Kollokationen>
		<K/>
		</Kollokationen>
		<AllgemeineErläuterungen>
				<Eintrag transitiv="">
					
					<Chinesisch>使……喜欢</Chinesisch>
					<BeispielSammlung>
					<Beispiel>
					<Satz>Das Restaurant hier gefällt mir sehr.</Satz>
					<Übersetzung/>
					</Beispiel>
					</BeispielSammlung>
					
   				</Eintrag>
			</AllgemeineErläuterungen>
	
	
</Entry>
